[
  {
    "id": "p001",
    "name": "John Doe",
    "age": 32,
    "contactInfo": {
      "type": "email",
      "email": "john.doe@example.com",
      "isVerified": true
    },
    "tags": ["employee", "engineering"],
    "metadata": {
      "joinDate": "2020-03-15",
      "department": "Engineering"
    }
  },
  {
    "id": "p002",
    "name": "Jane Smith",
    "age": 28,
    "contactInfo": {
      "type": "phone",
      "phoneNumber": "5551234567",
      "countryCode": "+1",
      "extension": "123"
    },
    "tags": ["employee", "marketing"],
    "metadata": {
      "joinDate": "2021-06-10",
      "department": "Marketing"
    }
  },
  {
    "id": "p003",
    "name": "Alice Johnson",
    "age": 45,
    "contactInfo": {
      "type": "address",
      "street": "123 Main St",
      "city": "San Francisco",
      "state": "CA",
      "postalCode": "94105",
      "country": "USA"
    },
    "tags": ["contractor"],
    "metadata": {
      "contractStart": "2022-01-01",
      "contractEnd": "2022-12-31"
    }
  }
]
